{
  "allowed_operations": [
    {
      "asset_id": "ast-dependency-lock",
      "markers": [
        "RANGE-MARKER-DEPENDENCY-FINDING-01"
      ],
      "operation": "inspect_dependency_manifest",
      "operation_id": "rop-dependency-inspect-lock"
    },
    {
      "asset_id": "ast-dependency-advisory",
      "markers": [
        "RANGE-MARKER-DEPENDENCY-DETECT-01",
        "RANGE-MARKER-DEPENDENCY-EVIDENCE-01"
      ],
      "operation": "inspect_asset",
      "operation_id": "rop-dependency-inspect-advisory"
    }
  ],
  "destruction": {
    "attestation_required": true,
    "remove_instance_state": true,
    "remove_network_state": true,
    "remove_temporary_storage": true
  },
  "expected_detections": [
    "RANGE-MARKER-DEPENDENCY-DETECT-01"
  ],
  "expected_findings": [
    "RANGE-MARKER-DEPENDENCY-FINDING-01"
  ],
  "forbidden_operations": [
    "external_connect",
    "cross_scenario_access",
    "arbitrary_command",
    "modify_answer_key"
  ],
  "initial_state": "A fictional package lock references a fictional advisory with no executable payload.",
  "kind": "dependency_advisory",
  "lateral_movement": {
    "allowed_asset_ids": [
      "ast-dependency-advisory",
      "ast-dependency-lock"
    ],
    "outside_assets_denied": true
  },
  "name": "Safe synthetic dependency advisory",
  "network": {
    "external_access": false,
    "mode": "none"
  },
  "reset": {
    "baseline_digest": "sha256:3e78529036423a036871d7e14e039bcd5b5a487b2fc3a9080a48f6c9108c0516",
    "deterministic": true,
    "strategy": "verified_baseline_copy"
  },
  "scenario_id": "scn-dependency-advisory",
  "schema_version": "1.0",
  "scoring": [
    {
      "criterion_id": "crit-dependency-finding",
      "kind": "finding",
      "marker": "RANGE-MARKER-DEPENDENCY-FINDING-01",
      "points": 40
    },
    {
      "criterion_id": "crit-dependency-detection",
      "kind": "detection",
      "marker": "RANGE-MARKER-DEPENDENCY-DETECT-01",
      "points": 30
    },
    {
      "criterion_id": "crit-dependency-evidence",
      "kind": "behavior",
      "marker": "RANGE-MARKER-DEPENDENCY-EVIDENCE-01",
      "points": 30
    }
  ],
  "stop_conditions": [
    "scope_deviation",
    "external_network_attempt",
    "cross_scenario_access",
    "prohibited_operation",
    "marker_tampering"
  ],
  "synthetic_data": {
    "contains_credentials": false,
    "contains_real_data": false,
    "marker_prefix": "RANGE-MARKER-",
    "root": "synthetic"
  },
  "target_id": "tgt-range-dependency",
  "test_case_id": "tc-range-dependency"
}
